### ISSUE TITLE
cant connect to LoadBalancer ip addr from remote host 

### ISSUE THREAD

**Issue by dirtbag** [google/metallb#363]
**Is this a bug report or a feature request?**:
Bug

**What happened**:
I have used the metallb and gotten it working with the default NGINX app as shown in the metallb setup.
I then tried setting up this kubernetes example at 
https://github.com/dcaro/learnk8/tree/master/lab1  
which sets up a mysql database and a web frontend app. It all seems to deploy just fine and I see the ip address getting assigned to the LoadBalancer 
[root@kubemaster ~]# kc get svc
NAME            TYPE           CLUSTER-IP     EXTERNAL-IP   PORT(S)        AGE
kubernetes      ClusterIP      10.96.0.1      <none>        443/TCP        15d
mysql           ClusterIP      10.111.71.15   <none>        3306/TCP       3h
nginx-service   NodePort       10.97.79.80    <none>        80:30900/TCP   15d
web             LoadBalancer   10.109.12.14   10.9.1.210    80:32000/TCP   19m

but the application (running on port 80) cannot be hit from another host outside the kubernetes cluster.. 
but from the kubernetes master, hitting 10.9.1.210 on port 80 works.. 

i did a sniffer dump on my "node2" and saw the following :
15:19:49.893222 IP 10.9.1.1.35674 > 10.9.1.210.http: Flags [S], seq 1451836541, win 29200, options [mss 1460,sackOK,TS val 3131495497 ecr 0,nop,wscale 8], length 0
15:19:51.913635 IP 10.9.1.1.35676 > 10.9.1.210.http: Flags [S], seq 2611810007, win 29200, options [mss 1460,sackOK,TS val 3131497517 ecr 0,nop,wscale 8], length 0
15:19:52.965469 IP 10.9.1.1.35676 > 10.9.1.210.http: Flags [S], seq 2611810007, win 29200, options [mss 1460,sackOK,TS val 3131498568 ecr 0,nop,wscale 8], length 0

so the packets are getting to the node, but its not responding.

**What you expected to happen**:
I expect to be able to hit the exposed port 80 on ip address 10.9.1.210 from other hosts in the 10.9.1.x/24 subnet on my network.

**How to reproduce it (as minimally and precisely as possible)**:
I guess do the setup for https://github.com/dcaro/learnk8/tree/master/lab1
its pretty simple to make those 4 files and deploy them.

**Anything else we need to know?**:
Probably.. 

**Environment**:
- MetalLB version:  metallb/speaker:v0.6.2  
- Kubernetes version: v1.12.3 
- BGP router type/version: ??
- OS (e.g. from /etc/os-release): CentOS Linux release 7.5.1804 (Core) 
- Kernel (e.g. `uname -a`):Linux kubemaster 3.10.0-862.14.4.el7.x86_64 #1 SMP Wed Sep 26 15:12:11 UTC 2018 x86_64 x86_64 x86_64 GNU/Linux

**Comment by dirtbag** [comment]
oops. it seems that the deployment of the pod that I was doing only deployed the service to one node. and of course the load-balancer chose the node that the service WASN'T running on, so I dont think its an issue with the metallb.. sorry for the noise.
