### ISSUE TITLE
L2 mode does not work for pods scheduled on master

### ISSUE THREAD

**Issue by zerkms** [google/metallb#371]
**Is this a bug report or a feature request?**:
A bug report

**What happened**:
I have a test cluster that consists of one master (untainted) and 2 worker nodes. There are a bunch of default pods (installed by kubeadm) and 3 extra apps I installed for tests: `source-ip-app`, `nginx` and `kubernetes-dashboard`.

`source-ip-app` and `nginx` are scheduled on `hq-srv04` (a worker node), `kubernetes-dashboard` is scheduled on `hq-srv02` (a master node).

```
# kubectl get pods --all-namespaces -o wide
NAMESPACE        NAME                                  READY   STATUS    RESTARTS   AGE   IP           NODE       NOMINATED NODE   READINESS GATES
default          nginx-5cd9c7f879-ftr8c                1/1     Running   0          17h   10.244.2.2   hq-srv04   <none>           <none>
default          source-ip-app-5bf59f5b75-bz9h6        1/1     Running   0          17h   10.244.2.3   hq-srv04   <none>           <none>
kube-system      coredns-86c58d9df4-l5lcz              1/1     Running   1          44h   10.244.0.8   hq-srv02   <none>           <none>
kube-system      coredns-86c58d9df4-x98v4              1/1     Running   1          44h   10.244.0.7   hq-srv02   <none>           <none>
kube-system      etcd-hq-srv02                         1/1     Running   1          44h   10.50.4.2    hq-srv02   <none>           <none>
kube-system      kube-apiserver-hq-srv02               1/1     Running   1          44h   10.50.4.2    hq-srv02   <none>           <none>
kube-system      kube-controller-manager-hq-srv02      1/1     Running   1          44h   10.50.4.2    hq-srv02   <none>           <none>
kube-system      kube-router-2zlcr                     1/1     Running   0          40h   10.50.4.2    hq-srv02   <none>           <none>
kube-system      kube-router-r6fm9                     1/1     Running   0          18h   10.50.4.4    hq-srv04   <none>           <none>
kube-system      kube-router-shshp                     1/1     Running   3          40h   10.50.4.1    hq-srv01   <none>           <none>
kube-system      kube-scheduler-hq-srv02               1/1     Running   1          44h   10.50.4.2    hq-srv02   <none>           <none>
kube-system      kubernetes-dashboard-f7445df4-r78tb   1/1     Running   0          13m   10.244.0.9   hq-srv02   <none>           <none>
metallb-system   controller-7cc9c87cfb-mmsr4           1/1     Running   0          17h   10.244.2.4   hq-srv04   <none>           <none>
metallb-system   speaker-kp59l                         1/1     Running   1          18h   10.50.4.1    hq-srv01   <none>           <none>
metallb-system   speaker-pgccr                         1/1     Running   0          18h   10.50.4.4    hq-srv04   <none>           <none>

# kubectl get svc --all-namespaces
NAMESPACE     NAME                      TYPE           CLUSTER-IP      EXTERNAL-IP   PORT(S)          AGE
default       clusterip                 ClusterIP      10.42.108.175   <none>        80/TCP           44h
default       kubernetes                ClusterIP      10.42.0.1       <none>        443/TCP          44h
default       loadbalancer              LoadBalancer   10.42.241.144   10.50.10.1    80:31607/TCP     18h
default       nginx                     LoadBalancer   10.42.158.183   10.50.10.0    8080:32113/TCP   18h
kube-system   kube-dns                  ClusterIP      10.42.0.10      <none>        53/UDP,53/TCP    44h
kube-system   kubernetes-dashboard-lb   LoadBalancer   10.42.27.28     10.50.10.2    443:31000/TCP    22m

# kubectl get endpoints --all-namespaces
NAMESPACE     NAME                      ENDPOINTS                                               AGE
default       clusterip                 10.244.2.3:8080                                         44h
default       kubernetes                10.50.4.2:6443                                          44h
default       loadbalancer              10.244.2.3:8080                                         18h
default       nginx                     10.244.2.2:80                                           18h
kube-system   kube-controller-manager   <none>                                                  44h
kube-system   kube-dns                  10.244.0.7:53,10.244.0.8:53,10.244.0.7:53 + 1 more...   44h
kube-system   kube-scheduler            <none>                                                  44h
kube-system   kubernetes-dashboard-lb   10.244.0.9:8443                                         22m

```
I can reach all 3 apps using their cluster ips.

What I found though is that if an application is scheduled to run on a master node, then it (the master node) does not respond to arp requests.

```
# arping -I br0 10.50.10.1
ARPING 10.50.10.1 from 10.50.1.1 br0
Unicast reply from 10.50.10.1 [90:E2:BA:75:93:4E]  0.956ms
Unicast reply from 10.50.10.1 [90:E2:BA:75:93:4E]  0.922ms

# but

# arping -I br0 10.50.10.2
ARPING 10.50.10.2 from 10.50.1.1 br0
^CSent 3 probes (3 broadcast(s))
Received 0 response(s)
```
The `hq-srv02` definitely recieves the arp requests (a tcpdump below)

```
20:39:13.774209 ARP, Request who-has 10.50.10.2 (ff:ff:ff:ff:ff:ff) tell 10.50.1.1, length 46
20:39:14.774502 ARP, Request who-has 10.50.10.2 (ff:ff:ff:ff:ff:ff) tell 10.50.1.1, length 46
20:39:15.774575 ARP, Request who-has 10.50.10.2 (ff:ff:ff:ff:ff:ff) tell 10.50.1.1, length 46
```
but does not respond

**What you expected to happen**:
I expect that whenever a pod is scheduled on - the load balancer IP should still respond to arp requests

**How to reproduce it (as minimally and precisely as possible)**:
Create a cluster with single master and metallb in L2 mode, schedule an app on it, create a service `type=LoadBalancer` and try to arping it.

**Anything else we need to know?**:
Not sure

**Environment**:
- MetalLB version: 0.7.3
- Kubernetes version: 1.13.1
- BGP router type/version: N/A
- OS (e.g. from /etc/os-release): Ubuntu 18.04.1 LTS (Bionic Beaver)
- Kernel (e.g. `uname -a`): Linux hq-srv02 4.15.0-43-generic #46-Ubuntu SMP Thu Dec 6 14:45:28 UTC 2018 x86_64 x86_64 x86_64 GNU/Linux

**Comment by zerkms** [comment]
Upd:

I found that a `speaker` process does not bind raw socket to the network interface on a master node:

```
root@hq-srv02:~/src# ss -pw
Recv-Q                         Send-Q                                                    Local Address:Port                                                         Peer Address:Port                          
0                              0                                                              *%enp4s0:ipv6-icmp                                                               *:*                              users:(("systemd-network",pid=629,fd=15))
```

While on a worker node:

```
root@hq-srv04:/home/ivan# ss -pw
Recv-Q            Send-Q                                                      Local Address:Port                                Peer Address:Port                                                              
0                 0                                [fe80::c852:4eff:fed6:5fc7]%veth7bb5ab0e:ipv6-icmp                                      *:*                 users:(("speaker",pid=30027,fd=20))             
0                 0                                 [fe80::8cd:32ff:fe63:73c6]%veth938bbaf3:ipv6-icmp                                      *:*                 users:(("speaker",pid=30027,fd=18))             
0                 0                                [fe80::1816:63ff:feb7:704f]%vethb68788a9:ipv6-icmp                                      *:*                 users:(("speaker",pid=30027,fd=16))             
0                 0                               [fe80::6c4e:b1ff:fe50:8b52]%kube-dummy-if:ipv6-icmp                                      *:*                 users:(("speaker",pid=30027,fd=11))             
0                 0                                  [fe80::5075:43ff:fed2:797]%kube-bridge:ipv6-icmp                                      *:*                 users:(("speaker",pid=30027,fd=8))              
0                 0                                      [fe80::92e2:baff:fe75:934e]%enp3s1:ipv6-icmp                                      *:*                 users:(("speaker",pid=30027,fd=12))             
0                 0                                                                *%enp3s1:ipv6-icmp                                      *:*                 users:(("systemd-network",pid=345,fd=17))
```

**Comment by zerkms** [comment]
Oh, now I see that `speaker` does not run there either, bingo :-)

**Comment by zerkms** [comment]
Yep, so I added master node tolerations to the `ds/speaker`

```yaml
      tolerations:
      - key: node-role.kubernetes.io/master
        effect: NoSchedule
```

and it works now.
